{
  "feedback_id": "feedback-asset-001-founder-list-question",
  "founder_id": "wpatent",
  "asset_id": "asset-001",
  "source_sync_id": "asset-001--2026-05-19T00-00-00Z",
  "feedback_type": "counter-question",
  "signal_strength": "medium",
  "notes": "Founder-list response: \"are there also anti-patent (like Creative Commons / Apache and GPL) strategies\"",
  "imported_at": "2026-05-19T01:30:00Z"
}
